{
  "claim_map_version": "1.0.0",
  "generated_utc": "2026-01-28T21:55:00Z",
  "evidence_policy": {
    "grade_a_required_for_high_risk": true,
    "locator_required_for_grade_a": true,
    "must_language_requires_grade_a": true,
    "minimum_citations_for_high_risk_claim": 1
  },
  "sources": [
    {
      "source_id": "HHS_MIN_NECESSARY",
      "title": "HHS Minimum Necessary Requirement",
      "url": "https://www.hhs.gov/hipaa/for-professionals/privacy/guidance/minimum-necessary-requirement/index.html",
      "retrieved_utc": "2026-01-28T21:40:00Z",
      "hash": "sha256:REDACTED_EXAMPLE_HASH",
      "evidence_grade": "A"
    },
    {
      "source_id": "HHS_SECURITY_RULE",
      "title": "HHS HIPAA Security Rule (overview)",
      "url": "https://www.hhs.gov/hipaa/for-professionals/security/index.html",
      "retrieved_utc": "2026-01-28T21:41:00Z",
      "hash": "sha256:REDACTED_EXAMPLE_HASH",
      "evidence_grade": "A"
    },
    {
      "source_id": "OWASP_LLM_TOP10",
      "title": "OWASP Top 10 for Large Language Model Applications",
      "url": "https://owasp.org/www-project-top-10-for-large-language-model-applications/",
      "retrieved_utc": "2026-01-28T21:42:00Z",
      "hash": "sha256:REDACTED_EXAMPLE_HASH",
      "evidence_grade": "B"
    }
  ],
  "claims": [
    {
      "claim_id": "c1",
      "claim_text": "Patient-data retrieval must be scoped to the minimum necessary for the intended purpose.",
      "claim_type": "privacy_requirement",
      "risk_level": "high",
      "required_evidence_grade": "A",
      "language_level_allowed": "must",
      "citations": [
        {
          "source_id": "HHS_MIN_NECESSARY",
          "locator": "Minimum Necessary Requirement — Overview and implementation guidance",
          "support_score": 0.84
        }
      ]
    },
    {
      "claim_id": "c2",
      "claim_text": "Systems that access ePHI must enforce safeguards and auditable controls to protect confidentiality and integrity.",
      "claim_type": "security_requirement",
      "risk_level": "high",
      "required_evidence_grade": "A",
      "language_level_allowed": "must",
      "citations": [
        {
          "source_id": "HHS_SECURITY_RULE",
          "locator": "Security Rule — safeguards overview",
          "support_score": 0.78
        }
      ]
    },
    {
      "claim_id": "c3",
      "claim_text": "Prompt injection attempts must not override policy controls or expand tool access beyond allowlisted capabilities.",
      "claim_type": "llm_security_requirement",
      "risk_level": "high",
      "required_evidence_grade": "B",
      "language_level_allowed": "must",
      "citations": [
        {
          "source_id": "OWASP_LLM_TOP10",
          "locator": "LLM01 Prompt Injection — risk definition and mitigations",
          "support_score": 0.80
        }
      ]
    },
    {
      "claim_id": "c4",
      "claim_text": "Systems must prevent sensitive information disclosure and data exfiltration attempts through model outputs and tool calls.",
      "claim_type": "llm_security_requirement",
      "risk_level": "high",
      "required_evidence_grade": "B",
      "language_level_allowed": "must",
      "citations": [
        {
          "source_id": "OWASP_LLM_TOP10",
          "locator": "LLM06 Sensitive Information Disclosure — risk definition and mitigations",
          "support_score": 0.78
        }
      ]
    }
  ]
}
